{
  "$schema": "benchmark-correctness-audit.schema.json",
  "schemaVersion": 1,
  "specRevision": 3,
  "auditedBranch": "issue-97",
  "auditedCommit": "940334da5e5132e4a2d8378e21e8eedc1771ca95",
  "auditedTreeDirty": true,
  "auditState": "PreRemediation",
  "gates": [
    {
      "id": "BVAL-01",
      "priority": "P0",
      "status": "Quarantined",
      "claimClass": "Directional",
      "competitiveClaimAllowed": false,
      "sourceFile": "src/devops/benchmarks/Rowles.LeanCorpus.Benchmarks/Search/GeoQueryBenchmarks.cs",
      "symbol": "GeoQueryBenchmarks",
      "defect": "The 50,000 metre radius is passed to a conversion expecting kilometres, so the Lucene radius is about 1,000 times too large.",
      "requiredProof": "The 49.9 km point is included, the 50.1 km point is excluded, and both engines return identical logical IDs; BKD versus geohash remains directional.",
      "fixtureId": "bval-01-geo-radius-boundaries",
      "fixturePath": ".config/devops/benchmark-correctness-fixtures/bval-01-geo-radius-boundaries.json",
      "fixtureSha256": "b21e32907134b0d751e1f0db1f77a4f89d7be215146a3fa06b148a5d140beb94",
      "fixtureState": "ExecutedPassing"
    },
    {
      "id": "BVAL-02",
      "priority": "P0",
      "status": "Quarantined",
      "claimClass": "Unqualified",
      "competitiveClaimAllowed": false,
      "sourceFile": "src/devops/benchmarks/Rowles.LeanCorpus.Benchmarks/Search/AggregationBenchmarks.cs",
      "symbol": "AggregationBenchmarks.LuceneNet_SearchWithStats",
      "defect": "Lucene writes a price point but reads absent NumericDocValues and only inspects the first leaf, allowing a no-op or partial aggregation.",
      "requiredProof": "Two segments produce non-zero count, sum, sum-of-squares, min, max, mean and variance matching an independent calculation.",
      "fixtureId": "bval-02-numeric-docvalues-multileaf",
      "fixturePath": ".config/devops/benchmark-correctness-fixtures/bval-02-numeric-docvalues-multileaf.json",
      "fixtureSha256": "c1856d6049f603159690077a0c52474d534f54801fa3df522ad4cae226bfe8c5",
      "fixtureState": "ExecutedPassing"
    },
    {
      "id": "BVAL-03",
      "priority": "P0",
      "status": "Quarantined",
      "claimClass": "Unqualified",
      "competitiveClaimAllowed": false,
      "sourceFile": "src/devops/benchmarks/Rowles.LeanCorpus.Benchmarks/Search/MoreLikeThisBenchmarks.cs",
      "symbol": "MoreLikeThisBenchmarks",
      "defect": "Lucene extracts terms and creates a query per invocation while LeanCorpus reuses terms extracted and cached on first access.",
      "requiredProof": "Selected terms and candidate IDs match, cache state is explicit, and timed extraction plus search boundaries are equivalent.",
      "fixtureId": "bval-03-morelikethis-cache-boundaries",
      "fixturePath": ".config/devops/benchmark-correctness-fixtures/bval-03-morelikethis-cache-boundaries.json",
      "fixtureSha256": "a7779dd79d9e920ff1e518e15413d9cc4590f3d9d30f2d6da63605c850bce40f",
      "fixtureState": "ExecutedPassing"
    },
    {
      "id": "BVAL-04",
      "priority": "P0",
      "status": "Quarantined",
      "claimClass": "Unqualified",
      "competitiveClaimAllowed": false,
      "sourceFile": "src/devops/benchmarks/Rowles.LeanCorpus.Benchmarks/Search/FunctionScoreQueryBenchmarks.cs",
      "symbol": "FunctionScoreQueryBenchmarks.LuceneNet_FunctionScoreQuery",
      "defect": "The Lucene price field has no DocValues and its score provider applies one multiplication rule instead of the four LeanCorpus score modes.",
      "requiredProof": "Populated price DocValues affect scores for Multiply, Replace, Sum and Max, with matching logical top-K results and defined missing or non-positive behaviour.",
      "fixtureId": "bval-04-function-score-modes-docvalues",
      "fixturePath": ".config/devops/benchmark-correctness-fixtures/bval-04-function-score-modes-docvalues.json",
      "fixtureSha256": "aa6735cec50dc34c8a4242c2ef02ff0f76798052cce1033af534869d1c37890a",
      "fixtureState": "ExecutedPassing"
    },
    {
      "id": "BVAL-05",
      "priority": "P0",
      "status": "Quarantined",
      "claimClass": "Unqualified",
      "competitiveClaimAllowed": false,
      "sourceFile": "src/devops/benchmarks/Rowles.LeanCorpus.Benchmarks/Infrastructure/SharedStandardIndex.cs",
      "symbol": "SharedStandardIndex",
      "defect": "The shared Lucene index uses default classic TF-IDF while LeanCorpus uses BM25, so ranked results use mismatched index-time and query-time similarity.",
      "requiredProof": "A matched BM25 profile sets the writer and searcher models explicitly and returns the same logical hits; defaults-as-shipped use a separate comparison ID.",
      "fixtureId": "bval-05-matched-bm25-index-and-query",
      "fixturePath": ".config/devops/benchmark-correctness-fixtures/bval-05-matched-bm25-index-and-query.json",
      "fixtureSha256": "370155867248111072ef7f2a9d5932d0086966a79f9dcdab8c00d723b744d3c7",
      "fixtureState": "ExecutedPassing"
    },
    {
      "id": "BVAL-06",
      "priority": "P0",
      "status": "Quarantined",
      "claimClass": "Directional",
      "competitiveClaimAllowed": false,
      "sourceFile": "src/devops/benchmarks/Rowles.LeanCorpus.Benchmarks/Index/IndexSortIndexBenchmarks.cs",
      "symbol": "IndexSortIndexBenchmarks",
      "defect": "The Lucene case sorts input in memory before indexing, reassigns document IDs and uses RAMDirectory, which is not native index sorting or the same persistence boundary.",
      "requiredProof": "Preserve original external IDs and prices, validate the exact document set and sorted order, and label the pre-sorted workload Directional with no competitive ratio.",
      "fixtureId": "bval-06-presorted-ingestion-identities",
      "fixturePath": ".config/devops/benchmark-correctness-fixtures/bval-06-presorted-ingestion-identities.json",
      "fixtureSha256": "40eaaee8cbee406749216c935527e36f2227a8fbacf7eebf9cb5bf0afa7273dd",
      "fixtureState": "ExecutedPassing"
    },
    {
      "id": "BVAL-07",
      "priority": "P0",
      "status": "Quarantined",
      "claimClass": "Unqualified",
      "competitiveClaimAllowed": false,
      "sourceFile": "src/devops/benchmarks/Rowles.LeanCorpus.Benchmarks/Search/CollapseAndFacetBenchmarks.cs",
      "symbol": "CollapseAndFacetBenchmarks",
      "defect": "Lucene collapse considers only TopN times ten candidates and facet pagination requests preceding buckets without extracting the requested offset page.",
      "requiredProof": "A group first present after candidate 250 is retained, representatives and totals match, and offset two with page size two returns C and D without duplicates.",
      "fixtureId": "bval-07-collapse-and-facet-pagination",
      "fixturePath": ".config/devops/benchmark-correctness-fixtures/bval-07-collapse-and-facet-pagination.json",
      "fixtureSha256": "bd892a4d2ef7f3d61637dda4d1016e494aa8aefa50b0c14bf0c1e87cb15c336f",
      "fixtureState": "ExecutedPassing"
    },
    {
      "id": "BVAL-08",
      "priority": "P0",
      "status": "Quarantined",
      "claimClass": "Unqualified",
      "competitiveClaimAllowed": false,
      "sourceFile": "src/devops/benchmarks/Rowles.LeanCorpus.Benchmarks/Search/SimilarityBenchmarks.cs",
      "symbol": "SimilarityBenchmarks",
      "defect": "One shared Lucene index is queried with BM25, TF-IDF and language models despite norms being created by its original index-time similarity.",
      "requiredProof": "Each incompatible model has a suitable writer fixture; effective writer and searcher models, norms, score vectors and ranking are validated.",
      "fixtureId": "bval-08-similarity-specific-norms",
      "fixturePath": ".config/devops/benchmark-correctness-fixtures/bval-08-similarity-specific-norms.json",
      "fixtureSha256": "71ece20d8a561eef0acfaf1b9db487ee1b9862c2730b5485eaed0c31e9e44a5a",
      "fixtureState": "ExecutedPassing"
    },
    {
      "id": "BVAL-09",
      "priority": "P0",
      "status": "Quarantined",
      "claimClass": "Unqualified",
      "competitiveClaimAllowed": false,
      "sourceFile": "src/devops/benchmarks/Rowles.LeanCorpus.Benchmarks/Search/HnswSearchBenchmarks.cs",
      "symbol": "HnswSearchBenchmarks",
      "defect": "Approximate vector results are rejected only at zero recall, and the quantisation case checks result count rather than neighbour relevance.",
      "requiredProof": "Compare deterministic approximate results with exact cosine ground truth at K=1, 10 and 100, record score and rank error plus quantisation score error, and enforce the fixture-pinned 0.9 recall floor; one of ten must fail.",
      "fixtureId": "bval-09-vector-recall-ground-truth",
      "fixturePath": ".config/devops/benchmark-correctness-fixtures/bval-09-vector-recall-ground-truth.json",
      "fixtureSha256": "8d0bb2964106046fd5d29e9cb355ba10398e087cd5d1c85d896b3da9b54358e9",
      "fixtureState": "ExecutedPassing"
    },
    {
      "id": "BVAL-10",
      "priority": "P1",
      "status": "Quarantined",
      "claimClass": "Unqualified",
      "competitiveClaimAllowed": false,
      "sourceFile": "src/devops/benchmarks/Rowles.LeanCorpus.Benchmarks/TextIntegration/TokenBudgetBenchmarks.cs",
      "symbol": "TokenBudgetBenchmarks",
      "defect": "Unlimited, truncated and rejected token-budget variants index different accepted documents and token counts from the same source dataset.",
      "requiredProof": "Run the pinned fixture through Core indexing and verify accepted document and indexed-token counts for Unlimited, Truncate and Reject; record accepted/rejected documents and indexed tokens for each DataForge mode; allow baseline ratios only for Unlimited and budget variants with identical accepted documents and indexed tokens, while keeping fixed-budget truncation and rejection in a no-baseline class.",
      "fixtureId": "bval-10-token-budget-work-counts",